{
  "$schema": "schema/hunt.schema.json",
  "$comment": "MVP-охота (docs/design/mvp-hunt.md): босс дня — MVP из RO (bosses[номер дня mod числа боссов] — сейчас 14, у всех игроков один), у каждого стихия, фазы и заряд. MVP умирает за бой: ОЗ и сила — уровень mvp.ranks (пробит, когда лучший урон ≥ ОЗ; старые сохранения встают на уровень по своему лучшему урону). Награда — высший порог tiers, которого достиг урон; победа («MVP!») — ещё шанс карты MVP (cards, гарантия cardPity) и следующий уровень. Герои стихии, к которой MVP уязвим, получают +weaknessAtk АТК. Старые боссы охоты (mob_mastering, mob_osiris, mob_moonlight) остались в сохранениях (best) — по ним считается уровень. Числа — docs/content/balance.md «MVP-охота», скрипт scripts/balance-hunt.ts.",
  "attemptsPerDay": 2,
  "timeLimitSeconds": 45,
  "sweep": true,
  "slot": 0,
  "bosses": [
    {
      "unit": "mvp_mastering",
      "title": "Король порингов",
      "legend": "Король порингов в короне набекрень. Скачет по полям Пронтеры и зовёт подданных на помощь.",
      "mechanics": [
        "Заряжает Королевский плюх — сбейте ультой",
        "Скачет по переднему ряду, оглушает",
        "Зовёт подданных на 60%",
        "Щит и ярость на 30%"
      ],
      "card": "card_mastering",
      "legacy": "mob_mastering"
    },
    {
      "unit": "mvp_osiris",
      "title": "Фараон пирамид Морроку",
      "legend": "Фараон, проснувшийся в пирамиде Морроку. Бинты держат его тело, проклятие стережёт гробницу.",
      "mechanics": [
        "Заряжает Проклятие пирамид — сбейте ультой",
        "Бинты: щит, каст сбивает оглушение",
        "Щит на 70%, стража гробницы на 40%"
      ],
      "card": "card_osiris",
      "legacy": "mob_osiris"
    },
    {
      "unit": "mvp_moonlight",
      "title": "Лиса из пещеры Пайона",
      "legend": "Девятихвостая лиса из пещеры Пайона. Играет с охотниками и прыгает к тем, кто слабее.",
      "mechanics": [
        "Заряжает Лисий огонь — сбейте ультой",
        "Прыгает в тыл к самому слабому",
        "Лисья стая на 50%, ярость на 25%"
      ],
      "card": "card_moonlight",
      "legacy": "mob_moonlight"
    },
    {
      "unit": "mvp_orc_lord",
      "title": "Вождь деревни орков",
      "legend": "Вождь деревни орков под Гефеном. Молот предков раскалывает землю, племя идёт за ним.",
      "mechanics": [
        "Заряжает Сокрушение земли — сбейте ультой",
        "Зовёт племя на 60%",
        "Ярость и ульта сразу на 30%"
      ],
      "card": "card_orc_lord"
    },
    {
      "unit": "mvp_mistress",
      "title": "Королева улья Мьёльнира",
      "legend": "Королева улья из пещер Мьёльнира. Гроза в крыльях и рой за спиной.",
      "mechanics": [
        "Заряжает Юпитель-гром — сбейте ультой",
        "Пневма: щит, каст сбивает оглушение",
        "Жалит тыл; рой на 60%, ярость на 25%"
      ],
      "card": "card_mistress"
    },
    {
      "unit": "mvp_dark_lord",
      "title": "Хозяин Гласт Хейма",
      "legend": "Хозяин Гласт Хейма. Метеоры с чёрного неба и мертвецы, что встают по его зову.",
      "mechanics": [
        "Заряжает Врата ада — сбейте ультой",
        "Цепи тьмы оглушают тыл",
        "Мертвецы на 60%, ярость и ульта на 30%"
      ],
      "card": "card_dark_lord"
    },
    {
      "unit": "mvp_baphomet",
      "title": "Хозяин Лабиринта",
      "legend": "Козлоголовый демон, хозяин Лабиринта. Тёмная коса и дети, что прибегают на зов отца.",
      "mechanics": [
        "Заряжает Тёмный удар — сбейте ультой",
        "Коса бьёт весь передний ряд",
        "Дети на 60%, ярость на 30%"
      ],
      "card": "card_baphomet"
    },
    {
      "unit": "mvp_pharaoh",
      "title": "Владыка Сфинкса",
      "legend": "Древний царь в глубине Сфинкса под Морроком. Бинты гробницы служат ему руками, жрицы Изиды — щитом.",
      "mechanics": [
        "Заряжает Тёмное дыхание — сбейте ультой",
        "Длань гробницы хватает самого раненого",
        "Саркофаг на 70%, жрицы Изиды на 50%",
        "Ярость и ульта сразу на 25%"
      ],
      "card": "card_pharaoh"
    },
    {
      "unit": "mvp_eddga",
      "title": "Хозяин леса Пайона",
      "legend": "Огненный тигр из леса за Пайоном. Эндура держит его на ногах, звери леса бегут на его рёв.",
      "mechanics": [
        "Заряжает Пламя тигра — сбейте ультой",
        "Рвёт лапой передний ряд, кровотечение",
        "Звери леса на 60%",
        "Эндура: ярость, защита и ульта на 30%"
      ],
      "card": "card_eddga"
    },
    {
      "unit": "mvp_dracula",
      "title": "Граф подземелья Гефена",
      "legend": "Вампир из глубин под башней магов Гефена. Пьёт кровь, чтобы лечиться, и зовёт летучих мышей.",
      "mechanics": [
        "Заряжает Ночь вампира — сбейте ультой",
        "Кровавая жатва лечит — сбейте оглушением",
        "Укус по самому раненому; мыши на 70%",
        "Кровавая луна: ярость и ульта на 40%"
      ],
      "card": "card_dracula"
    },
    {
      "unit": "mvp_maya",
      "title": "Матка Муравьиного ада",
      "legend": "Гигантская матка в норах Муравьиного ада. Панцирь крепче стали, солдаты гнезда — по первому зову.",
      "mechanics": [
        "Заряжает Гнев муравейника — сбейте ультой",
        "Панцирь: щит, каст сбивает оглушение",
        "Кислота снимает защиту; солдаты на 60%",
        "Ярость на 30%"
      ],
      "card": "card_maya"
    },
    {
      "unit": "mvp_turtle_general",
      "title": "Страж острова черепах",
      "legend": "Старый генерал острова черепах. Прячется в панцирь, бьёт молотом так, что гудит весь остров.",
      "mechanics": [
        "Заряжает Удар генерала — сбейте ультой",
        "Панцирь: +50% защиты, каст сбивает оглушение",
        "Щит на 70%, стража острова на 50%",
        "Ярость и ульта сразу на 25%"
      ],
      "card": "card_turtle_general"
    },
    {
      "unit": "mvp_amon_ra",
      "title": "Владыка пирамиды",
      "legend": "Царь-жрец на дне пирамиды Морроку. Солнце Ра судит пришедших, мумии стерегут его покой.",
      "mechanics": [
        "Заряжает Суд Ра — сбейте ультой",
        "Кирие: щит, каст сбивает оглушение",
        "Огненный столп; стражи пирамиды на 60%",
        "Гнев солнца: ярость и ульта на 30%"
      ],
      "card": "card_amon_ra"
    },
    {
      "unit": "mvp_doppelganger",
      "title": "Тень подземелья Гефена",
      "legend": "Демон-зеркало из подземелья Гефена. Принимает облик мечника и бьёт быстрее любого из вас.",
      "mechanics": [
        "Заряжает Кошмар двойника — сбейте ультой",
        "Спешка: вдвое быстрее на 3 с",
        "Возникает за спиной слабого; бесы на 60%",
        "Ярость и ульта на 30%"
      ],
      "card": "card_doppelganger"
    }
  ],
  "mvp": {
    "weaknessAtk": 1,
    "armorAtk": 0.15,
    "cardChance": 0.12,
    "cardPity": 10,
    "startRank": 2,
    "jump": 0.9,
    "ranks": [
      {
        "hp": 2500,
        "atk": 0.6,
        "def": 0.8
      },
      {
        "hp": 7000,
        "atk": 1,
        "def": 0.8
      },
      {
        "hp": 13500,
        "atk": 1.5,
        "def": 0.8
      },
      {
        "hp": 22500,
        "atk": 2.5,
        "def": 0.8
      },
      {
        "hp": 36000,
        "atk": 4,
        "def": 0.8
      },
      {
        "hp": 54000,
        "atk": 7,
        "def": 0.8
      },
      {
        "hp": 81000,
        "atk": 11,
        "def": 0.8
      },
      {
        "hp": 117000,
        "atk": 18,
        "def": 0.8
      },
      {
        "hp": 171000,
        "atk": 26,
        "def": 0.8
      },
      {
        "hp": 247500,
        "atk": 36,
        "def": 0.8
      },
      {
        "hp": 359000,
        "atk": 48,
        "def": 0.8
      },
      {
        "hp": 520500,
        "atk": 64,
        "def": 0.8
      },
      {
        "hp": 754500,
        "atk": 84,
        "def": 0.8
      },
      {
        "hp": 1094000,
        "atk": 110,
        "def": 0.8
      },
      {
        "hp": 1586500,
        "atk": 145,
        "def": 0.8
      }
    ]
  },
  "cards": [
    {
      "id": "card_mastering",
      "name": "Карта Мастеринга",
      "slot": "helmet",
      "bonus": {
        "hp": 0.08,
        "atk": 0.08,
        "def": 0.08,
        "spd": 0.05
      },
      "text": "Корона короля порингов: понемногу всего."
    },
    {
      "id": "card_osiris",
      "name": "Карта Осириса",
      "slot": "armor",
      "bonus": {
        "hp": 0.25
      },
      "text": "Бинты фараона: +25% здоровья."
    },
    {
      "id": "card_moonlight",
      "name": "Карта Лунного цветка",
      "slot": "boots",
      "bonus": {
        "spd": 0.15,
        "atk": 0.05
      },
      "text": "Лисья прыть: +15% скорости, +5% атаки."
    },
    {
      "id": "card_orc_lord",
      "name": "Карта Орк-лорда",
      "slot": "armor",
      "bonus": {
        "def": 0.3,
        "hp": 0.1
      },
      "text": "Шкура вождя: +30% защиты, +10% здоровья."
    },
    {
      "id": "card_mistress",
      "name": "Карта Мистресс",
      "slot": "helmet",
      "bonus": {
        "atk": 0.12,
        "spd": 0.1
      },
      "text": "Жало королевы: +12% атаки, +10% скорости."
    },
    {
      "id": "card_dark_lord",
      "name": "Карта Тёмного лорда",
      "slot": "weapon",
      "bonus": {
        "atk": 0.3,
        "hp": -0.1
      },
      "text": "Сила тьмы: +30% атаки, но −10% здоровья."
    },
    {
      "id": "card_baphomet",
      "name": "Карта Бафомета",
      "slot": "weapon",
      "bonus": {
        "atk": 0.25,
        "spd": 0.05
      },
      "text": "Коса Бафомета: +25% атаки и +5% скорости."
    },
    {
      "id": "card_pharaoh",
      "name": "Карта Фараона",
      "slot": "helmet",
      "bonus": {
        "spd": 0.12,
        "def": 0.12
      },
      "text": "Венец фараона: навыки чаще — +12% скорости, +12% защиты."
    },
    {
      "id": "card_eddga",
      "name": "Карта Эдди",
      "slot": "boots",
      "bonus": {
        "def": 0.25,
        "spd": 0.05,
        "hp": -0.08
      },